{
  "$schema": "https://json-schema.org/draft/2020-12/schema",
  "$id": "https://lorenzballe.github.io/knowit/cards/card.schema.json",
  "title": "Astute card",
  "description": "One card in the bank: what it asks, what it answers, and the one move it trains. The field names match lib/data/card_json.dart; check.py enforces what a schema cannot say.",
  "type": "object",
  "additionalProperties": false,
  "required": ["id", "topic", "kind", "difficulty", "principle", "question", "answer", "move", "source", "keywords", "era", "region", "hook", "mood", "numeracy", "abstraction", "shelf_life", "mature", "language"],
  "properties": {
    "id": {
      "type": "string",
      "pattern": "^[a-z_]+-[a-z0-9][a-z0-9-]*$",
      "description": "Topic key, a dash, then anything unique. Never reused, even for a retired card."
    },
    "topic": {
      "enum": ["thinking", "space", "technology", "language", "nature", "economics", "pop_culture", "science", "history", "psychology", "weird_facts", "human_body", "philosophy", "sport", "cinema", "music", "art", "medicine", "food", "life"]
    },
    "kind": {
      "enum": ["read", "pickOne", "number", "estimate", "debate"],
      "description": "read: turn it over. pickOne: commit to an option. number: work out an exact number. estimate: a Fermi estimate, judged within a factor. debate: take a side, then meet the other one; never graded."
    },
    "difficulty": { "enum": ["easy", "medium", "hard"] },
    "principle": {
      "enum": ["none", "baseRate", "survivorship", "regression", "confirmation", "anchoring", "sampling", "confounding", "counterfactual", "multipleComparisons", "availability", "sunkCost", "conjunction", "conditional", "independence", "coincidence", "exponential", "reflection", "simpson", "estimation", "computation"],
      "description": "What the card is an instance of. Every graded card has one; a read and a debate have none."
    },
    "question": { "type": "string", "minLength": 1 },
    "answer": { "type": "string", "description": "The reveal. On a number or estimate card it is the last line of the steps." },
    "move": { "type": "string", "minLength": 1, "description": "The one line that survives the card." },
    "ask": { "type": "string", "description": "The question the reader takes into their own day: the card turned on their life. One sentence ending in a question mark." },
    "end": { "enum": ["keep", "ask"], "description": "Which one box the back ends on: the move to keep (the default) or the question to ask yourself, whichever is stronger on this card. 'ask' needs an ask." },
    "both": { "type": "boolean", "description": "The back shows both boxes. Only when the card truly needs the two; one box is the rule." },
    "trap": { "type": "string", "description": "The wrong answer most people reach for first, and why it feels right." },
    "hint": { "type": "string", "description": "A way in, without the number." },
    "steps": { "type": "array", "items": { "type": "string", "minLength": 1 }, "description": "The worked solution, one move per line." },
    "simply": { "type": "string", "description": "A second way in: a concrete image, not the same words made smaller." },
    "counterpoint": { "type": "string", "description": "On a debate, the strongest case against whichever side was taken." },
    "options": { "type": "array", "items": { "type": "string", "minLength": 1 }, "minItems": 2, "maxItems": 3 },
    "correct": { "type": "integer", "minimum": 0 },
    "value": { "type": "number" },
    "unit": { "type": "string" },
    "tolerance": { "type": "number", "minimum": 0 },
    "withinFactor": { "type": "number", "minimum": 1 },
    "sides": { "type": "array", "items": { "type": "string", "minLength": 1 }, "minItems": 2, "maxItems": 2 },
    "genre": {
      "type": "string",
      "pattern": "^[a-z_]+\\.[a-z0-9_]+$",
      "description": "One of the six genres under the topic, by id (`space.black_holes`), from lib/data/genres.dart. Every card but a Thinking one has it."
    },
    "strand": {
      "type": "string",
      "pattern": "^[a-z_]+\\.[a-z0-9_]+\\.[a-z0-9_]+$",
      "description": "One of the three strands under the genre, by id (`space.black_holes.event_horizons`). What a reader would name if asked what they wanted to read about."
    },
    "keywords": {
      "type": "array",
      "items": { "type": "string", "minLength": 2, "maxLength": 40 },
      "minItems": 3,
      "maxItems": 6,
      "uniqueItems": true,
      "description": "Three to six lowercase handles for what the card is about — the things, people, places and ideas in it — for search and for telling two cards apart."
    },
    "era": {
      "enum": ["timeless", "ancient", "medieval", "early_modern", "nineteenth", "twentieth", "recent"],
      "description": "When the matter is set. `timeless` for a mechanism or a principle; `recent` is the last twenty-five years."
    },
    "region": {
      "enum": ["none", "world", "europe", "americas", "africa", "middle_east", "asia", "oceania"],
      "description": "Where it is set. `none` when the card has no place; `world` when it is everywhere at once."
    },
    "place": {
      "type": "object",
      "additionalProperties": false,
      "required": ["country"],
      "properties": {
        "country": {"type": "string", "pattern": "^[A-Z]{2}$", "description": "ISO 3166-1 alpha-2 of the country the card is about: `IT`."},
        "region": {"type": "string", "pattern": "^[A-Z]{2}-[A-Z0-9]{1,3}$", "description": "ISO 3166-2 of the region, for a card about a region or about a city in it: `IT-45`."},
        "city": {"type": "string", "minLength": 2, "maxLength": 60, "description": "The city in English, for a card about a city: `Modena`. A city card has `region`, `lat`, `lon` and `km` too."},
        "lat": {"type": "number", "minimum": -90, "maximum": 90, "description": "The city's centre."},
        "lon": {"type": "number", "minimum": -180, "maximum": 180, "description": "The city's centre."},
        "km": {"type": "number", "minimum": 3, "maximum": 80, "description": "How far from the centre a reader still counts as being from here: about 15 for a town, 20 to 30 for a city and the towns around it."}
      },
      "description": "Where the card belongs, for a card about a place rather than one for everyone. It is dealt only to readers who live there (lib/models/place.dart, docs/PLACES.md): a country card to anyone in the country, a region card to anyone in the region, a city card to anyone within `km` of its centre. It never becomes anyone else's question of the day, common card or shelf."
    },
    "hook": {
      "enum": ["misconception", "puzzle", "story", "number", "mechanism", "paradox", "practical", "origin"],
      "description": "What pulls the reader in: a belief to overturn, a thing to work out, something that happened, a figure that surprises, how it works, two truths that clash, something to use today, where a thing came from."
    },
    "mood": {
      "enum": ["wonder", "practical", "sober", "dark", "playful"],
      "description": "The register the card is read in."
    },
    "numeracy": {
      "type": "integer",
      "minimum": 0,
      "maximum": 3,
      "description": "How much number-sense the card asks for: 0 none, 1 a figure to take in, 2 a comparison or a ratio, 3 a calculation."
    },
    "abstraction": {
      "enum": ["concrete", "mixed", "abstract"],
      "description": "Whether the card is about a thing you can picture, an idea, or one through the other."
    },
    "shelf_life": {
      "enum": ["evergreen", "years", "months"],
      "description": "How soon the claim could go stale: never, in a few years, within the year. Anything but evergreen is re-checked."
    },
    "mature": {
      "type": "boolean",
      "description": "Sex, drugs, violence, gambling or death in detail. Kept out of a family setting."
    },
    "language": {
      "enum": ["en", "it", "es", "fr", "de", "pt", "nl", "pl", "ru", "tr", "ja", "ko", "zh"],
      "description": "The language the card is written in."
    },
    "builds_on": {
      "type": "array",
      "items": { "type": "string" },
      "maxItems": 3,
      "uniqueItems": true,
      "description": "Ids of cards a reader is better off having met first. The dealer holds this one back until they have, where it can."
    },
    "figure": {
      "enum": ["none", "dots", "nested_circles", "doubling", "bars", "timeline", "map"],
      "description": "The picture that would help, if one would, in the vocabulary tool/illustrations can draw."
    },
    "diagram": {
      "type": "object",
      "required": ["type"],
      "description": "The picture itself, as data the app draws and animates in the card's colour: dots, bars, scale, area, split, line or timeline. Every number in it is one the card states or its steps work out. tool/cards/diagrams.py holds the rules for each kind."
    },
    "scene": {
      "type": "object",
      "required": ["type"],
      "description": "Something the reader plays with before the answer, as data the app draws: today `slider` (move one quantity, watch another follow measured points, with a line that changes at the moments that matter). tool/cards/scenes.py holds the rules."
    },
    "also": {
      "type": "array",
      "items": { "type": "string", "pattern": "^[a-z_]+\\.[a-z0-9_]+\\.[a-z0-9_]+$" },
      "maxItems": 3,
      "uniqueItems": true,
      "description": "Other strands the card is genuinely about, by id, in any subject: a card on tides is the Moon and also Gravity. A reader who turned the primary strand off and one of these on still meets it."
    },
    "source_kind": {
      "enum": ["paper", "statistics", "primary_document", "institution", "reference_work", "book", "standard", "news_archive", "company", "arithmetic"],
      "description": "What kind of thing the reference is. arithmetic: no source but the reader, who can redo it. The plan spreads these so a strand is not all papers or all press pages."
    },
    "quote": {
      "type": "string",
      "description": "The passage of the reference, verbatim and at most forty words, that states the claim. Copied by the reader stage from the page it opened, and checked against the page by a program. The card's figures are in it."
    },
    "source": { "type": "string", "minLength": 1, "description": "The short label the reader sees: institution and document, or the name of the result." },
    "reference": { "type": "string", "description": "Where the claim can be checked: a URL, a DOI, or a book and page. Required on every generated card." },
    "written": { "type": "string", "pattern": "^\\d{4}-\\d{2}-\\d{2}$", "description": "The day the card was generated." },
    "checked": { "type": "string", "pattern": "^\\d{4}-\\d{2}-\\d{2}$", "description": "The day a person, or the monthly re-check, last confirmed the card against its source (tool/quality). Readers' reports from before it count as answered." },
    "disabled": { "type": "boolean", "description": "Retired: never dealt again, still opens in a deck that already holds it." }
  }
}
