{
  "id": "space-perseverance-7",
  "topic": "space",
  "genre": "space.mars_and_rovers",
  "strand": "space.mars_and_rovers.perseverance",
  "kind": "pickOne",
  "difficulty": "medium",
  "principle": "availability",
  "question": "In January 2024 Ingenuity, the helicopter carried to Mars by Perseverance, flew for the last time. What ended its flights?",
  "options": [
    "Dust settling on its solar panel",
    "Bland sand its camera could not track",
    "Its batteries failing in winter cold"
  ],
  "correct": 1,
  "answer": "Bland sand its camera could not track. Ingenuity judged its speed by following features on the ground; over smooth ripples it found too few, came down too fast and tilted, and all four rotor blades snapped. It had flown 72 times, against a plan of five, until the ground gave it nothing to hold.",
  "move": "A system that steers by what it sees fails where there is nothing to see.",
  "trap": "Blaming dust on the panels, the famous end of other Mars craft.",
  "keywords": [
    "ingenuity",
    "mars helicopter",
    "visual navigation",
    "jezero crater"
  ],
  "era": "recent",
  "region": "none",
  "hook": "story",
  "mood": "sober",
  "numeracy": 1,
  "abstraction": "concrete",
  "shelf_life": "evergreen",
  "mature": false,
  "language": "en",
  "figure": "bars",
  "diagram": {
    "type": "bars",
    "unit": "flights",
    "items": [
      {
        "label": "Planned",
        "value": 5
      },
      {
        "label": "Flown",
        "value": 72,
        "hi": true
      }
    ]
  },
  "source": "NASA JPL accident investigation, 2024",
  "source_kind": "institution",
  "reference": "https://www.jpl.nasa.gov/news/nasa-performs-first-aircraft-accident-investigation-on-another-world/",
  "written": "2026-09-27"
}
