{
  "id": "cinema-silence-1",
  "topic": "cinema",
  "genre": "cinema.sound_design",
  "strand": "cinema.sound_design.silence",
  "kind": "read",
  "difficulty": "easy",
  "principle": "none",
  "question": "Why do sound crews record a minute of an empty, quiet room on every set?",
  "answer": "To have silence that matches. Every room hums with its own air, lights and distant traffic, and the dialogue carries that bed. Cut out a cough and leave digital zero, and the gap sounds as if the sound has failed. Editors patch it with that room's tone, recorded while the whole crew stood still.",
  "move": "Real quiet always has a texture; pure nothing sounds like a fault.",
  "keywords": [
    "room tone",
    "dialogue editing",
    "film sets",
    "ambience"
  ],
  "era": "timeless",
  "region": "none",
  "hook": "mechanism",
  "mood": "practical",
  "numeracy": 0,
  "abstraction": "concrete",
  "shelf_life": "evergreen",
  "mature": false,
  "language": "en",
  "figure": "none",
  "source": "Purcell, Dialogue Editing for Motion Pictures",
  "source_kind": "book",
  "reference": "Purcell, Dialogue Editing for Motion Pictures: A Guide to the Invisible Art, Focal Press, 2007",
  "written": "2026-09-26",
  "disabled": true
}
